,name,name_eng,description_short,description,founded_date,product,homepage,employee_cnt,revenue,ceo_name,email,tel,fax,address1,address2,post_code,facebook,youtube,logo,hash_tag,nation_id,industry_id,is_active,created_at,updated_at
2335,Horizon Global Corporation,Horizon Global Corporation,"Horizon Global Corporation engages in the design, manufacture, and distribution of towing, trailering, cargo management, and other related accessory products worldwide. It operates in two segments, Horizon Americas and Horizon Europe-Africa. The company provides towing products, such as hitches/tow bars, fifth wheels, gooseneck hitches, weight distribution systems, brake controllers, wiring harnesses, draw bars, ball mounts, crossbars, security products, and other towing accessories. It also offers trailering products, including brake controllers, jacks, winches, couplers, interior and exterior vehicle lighting, and brake replacement parts. In addition, the company provides cargo management products comprising bike racks, roof cross bar systems, cargo carriers, luggage boxes, car interior protective products, loading ramps, and interior travel organizers. Further, it offers other products consisting of tubular push and sports bars, side steps, skid plates, and oil pans. The company sells its products under the Reese, Draw-Tite, Westfalia, Bulldog, BTM, Fulton, Reese Secure, Reese Explorer, Reese Power Sports, Reese Towpower, ROLA, Tekonsha, WesBar, and Witter Towbar Systems brands. It serves aftermarket, automotive original equipment manufacturers, automotive original equipment servicers, retail, e-commerce, and industrial customers within the agricultural, automotive, construction, horse/livestock, industrial, marine, military, recreational, trailer, and utility markets. The company was incorporated in 2015 and is headquartered in Plymouth, Michigan.","Horizon Global Corporation engages in the design, manufacture, and distribution of towing, trailering, cargo management, and other related accessory products worldwide. It operates in two segments, Horizon Americas and Horizon Europe-Africa. The company provides towing products, such as hitches/tow bars, fifth wheels, gooseneck hitches, weight distribution systems, brake controllers, wiring harnesses, draw bars, ball mounts, crossbars, security products, and other towing accessories. It also offers trailering products, including brake controllers, jacks, winches, couplers, interior and exterior vehicle lighting, and brake replacement parts. In addition, the company provides cargo management products comprising bike racks, roof cross bar systems, cargo carriers, luggage boxes, car interior protective products, loading ramps, and interior travel organizers. Further, it offers other products consisting of tubular push and sports bars, side steps, skid plates, and oil pans. The company sells its products under the Reese, Draw-Tite, Westfalia, Bulldog, BTM, Fulton, Reese Secure, Reese Explorer, Reese Power Sports, Reese Towpower, ROLA, Tekonsha, WesBar, and Witter Towbar Systems brands. It serves aftermarket, automotive original equipment manufacturers, automotive original equipment servicers, retail, e-commerce, and industrial customers within the agricultural, automotive, construction, horse/livestock, industrial, marine, military, recreational, trailer, and utility markets. The company was incorporated in 2015 and is headquartered in Plymouth, Michigan.",2015-06-23,Auto Parts,https://www.horizonglobal.com,3800,782120000,Mr. Terrence Gohl,NA,17346563000,NA,"47912 Halyard Drive, Suite 100","Plymouth, MICHIGAN, US",48170,https://www.horizonglobal.com,https://www.horizonglobal.com,https://financialmodelingprep.com/image-stock/HZN.png,"#Horizon Global Corporation, #Auto Parts, #Consumer Cyclical",10,1,TRUE,2022-05-23 17:49,2022-05-23 17:49
2453,QuantumScape Corporation,QuantumScape Corporation,"QuantumScape Corporation, a development stage company, focuses on the development and commercialization of solid-state lithium-metal batteries for electric vehicles and other applications. The company was founded in 2010 and is headquartered in San Jose, California.","QuantumScape Corporation, a development stage company, focuses on the development and commercialization of solid-state lithium-metal batteries for electric vehicles and other applications. The company was founded in 2010 and is headquartered in San Jose, California.",2020-11-23,Auto Parts,https://www.quantumscape.com,600,0,Industrials,NA,408-452-2000,NA,1730 Technology Drive,"San Jose, CA, US",95110,https://www.quantumscape.com,https://www.quantumscape.com,https://financialmodelingprep.com/image-stock/QS.png,"#QuantumScape Corporation, #Auto Parts, #Consumer Cyclical",10,1,TRUE,2022-05-23 17:49,2022-05-23 17:49
2563,Garrett Motion Inc.,Garrett Motion Inc.,"Garrett Motion Inc., together with its subsidiaries, designs, manufactures, and sells turbocharger and electric-boosting technologies for light and commercial vehicle original equipment manufacturers worldwide. The company offers light vehicle gasoline and diesel, and commercial vehicle turbochargers; and provides automotive software solutions. It offers its products in the aftermarket through distributors. Garrett Motion Inc. was incorporated in 2018 and is headquartered in Rolle, Switzerland.","Garrett Motion Inc., together with its subsidiaries, designs, manufactures, and sells turbocharger and electric-boosting technologies for light and commercial vehicle original equipment manufacturers worldwide. The company offers light vehicle gasoline and diesel, and commercial vehicle turbochargers; and provides automotive software solutions. It offers its products in the aftermarket through distributors. Garrett Motion Inc. was incorporated in 2018 and is headquartered in Rolle, Switzerland.",2021-05-03,Auto Parts,https://www.garrettmotion.com,6500,3633000000,Mr. Olivier  Rabiller,NA,41 21 695 30 00,NA,La Pice 16,"Rolle, , CH",1180,https://www.garrettmotion.com,https://www.garrettmotion.com,https://financialmodelingprep.com/image-stock/GTX.png,"#Garrett Motion Inc., #Auto Parts, #Consumer Cyclical",10,1,TRUE,2022-05-23 17:49,2022-05-23 17:49
2653,"Aeva Technologies, Inc.","Aeva Technologies, Inc.","Aeva Technologies, Inc., through its frequency modulated continuous wave (FMCW) sensing technology, designs a 4D LiDAR-on-chip that enables the adoption of LiDAR across various applications. from automated driving to consumer electronics, consumer health, industrial automation, and security application. The company was founded in 2017 is based in Mountain View, California.","Aeva Technologies, Inc., through its frequency modulated continuous wave (FMCW) sensing technology, designs a 4D LiDAR-on-chip that enables the adoption of LiDAR across various applications. from automated driving to consumer electronics, consumer health, industrial automation, and security application. The company was founded in 2017 is based in Mountain View, California.",2020-02-27,Auto Parts,https://www.aeva.com,227,9265000,Mr. Soroush Salehian Dardashti,NA,650-353-6361,NA,555 Bryant Street,"Palo Alto, CA, US",94043,https://www.aeva.com,https://www.aeva.com,https://financialmodelingprep.com/image-stock/AEVA.png,"#Aeva Technologies, Inc., #Auto Parts, #Consumer Cyclical",10,1,TRUE,2022-05-23 17:49,2022-05-23 17:49
2684,"Toyoda Gosei Co., Ltd.","Toyoda Gosei Co., Ltd.","Toyoda Gosei Co., Ltd. manufactures and sells automotive parts, optoelectronic products, and general industry products. The company offers weatherstrips products, such as opening trim weatherstrips, door glass runs, door and outer weatherstrips, and luggage weatherstrips; functional components, including fuel tank module components, power train parts, and chassis and drive train parts; interior and exterior parts; and safety system products, such as airbags, steering wheels, and other products. It also provides solar LEDs, UV-C LED modules, and UV-C LED water purification units; and general industry products, including air conditioning products, home construction components, construction and industrial machinery parts, and LED dynamo lights. It has operations in Japan, the Americas, Europe and Africa, and Asia. Toyoda Gosei Co., Ltd. was incorporated in 1949 and is headquartered in Kiyosu, Japan.","Toyoda Gosei Co., Ltd. manufactures and sells automotive parts, optoelectronic products, and general industry products. The company offers weatherstrips products, such as opening trim weatherstrips, door glass runs, door and outer weatherstrips, and luggage weatherstrips; functional components, including fuel tank module components, power train parts, and chassis and drive train parts; interior and exterior parts; and safety system products, such as airbags, steering wheels, and other products. It also provides solar LEDs, UV-C LED modules, and UV-C LED water purification units; and general industry products, including air conditioning products, home construction components, construction and industrial machinery parts, and LED dynamo lights. It has operations in Japan, the Americas, Europe and Africa, and Asia. Toyoda Gosei Co., Ltd. was incorporated in 1949 and is headquartered in Kiyosu, Japan.",2010-10-08,Auto Parts,https://www.toyoda-gosei.com,38823,7.21E+11,NA,NA,81 52 400 1452,NA,1 Haruhinagahata,"Kiyosu, , JP",452-8564,https://www.toyoda-gosei.com,https://www.toyoda-gosei.com,https://financialmodelingprep.com/image-stock/TGOSY.png,"#Toyoda Gosei Co., Ltd., #Auto Parts, #Consumer Cyclical",10,1,TRUE,2022-05-23 17:49,2022-05-23 17:49
2707,"Sumitomo Electric Industries, Ltd.","Sumitomo Electric Industries, Ltd.","Sumitomo Electric Industries, Ltd. manufactures and sells electric wires and cables worldwide. It operates through five segments: Automotive, Infocommunications, Electronics, Environment and Energy, and Industrial Materials and Others. The company offers wiring harnesses and electrical components; steel cords for tire reinforcement; steel wires for springs; wiring materials; optical lenses for infrared devices; abrasion-resistant parts/materials; heat shrink and heat-resistant tubing/tapes; magnet wires; aluminum bars/wires; spinel products; products for electronic devices; sintered parts; and EV quick-charger connector assemblies. It also provides fibers and optical fiber cables; optical connectors; optical fiber couplers and splitter modules; optical termination and splice boxes, and closures; optical fiber amplifiers; devices for large/small scale communication uses; optical transceiver modules and devices, and wireless devices; H-PCF; EO/OE converters; coaxial cables, flat components, insulated electronic and spiral shielded wires, cables, and flexible printed circuits; optical lenses for infrared devices; fusion splicers and tools; and data center solutions. In addition, the company offers intelligent transport system and IT asset management/security products; CATV systems; contents distribution network; and wind profiler radars. Further, it provides plated and alloy wires, fluoroplastics-coated materials, sintered ZnS lenses, semiconductors substrates, thermal control devices, and tool-related products; superconducting products; various energy and environment systems; products for railway and transport machinery; steel wires; polytetrafluoroethylene porous material; Celmet, a porous metal; cutting and plastic working tools; and alloy parts. The company was formerly known as Sumitomo Electric Wire & Cable Works and changed its name to Sumitomo Electric Industries, Ltd. in 1939. The company was founded in 1897 and is headquartered in Osaka, Japan.","Sumitomo Electric Industries, Ltd. manufactures and sells electric wires and cables worldwide. It operates through five segments: Automotive, Infocommunications, Electronics, Environment and Energy, and Industrial Materials and Others. The company offers wiring harnesses and electrical components; steel cords for tire reinforcement; steel wires for springs; wiring materials; optical lenses for infrared devices; abrasion-resistant parts/materials; heat shrink and heat-resistant tubing/tapes; magnet wires; aluminum bars/wires; spinel products; products for electronic devices; sintered parts; and EV quick-charger connector assemblies. It also provides fibers and optical fiber cables; optical connectors; optical fiber couplers and splitter modules; optical termination and splice boxes, and closures; optical fiber amplifiers; devices for large/small scale communication uses; optical transceiver modules and devices, and wireless devices; H-PCF; EO/OE converters; coaxial cables, flat components, insulated electronic and spiral shielded wires, cables, and flexible printed circuits; optical lenses for infrared devices; fusion splicers and tools; and data center solutions. In addition, the company offers intelligent transport system and IT asset management/security products; CATV systems; contents distribution network; and wind profiler radars. Further, it provides plated and alloy wires, fluoroplastics-coated materials, sintered ZnS lenses, semiconductors substrates, thermal control devices, and tool-related products; superconducting products; various energy and environment systems; products for railway and transport machinery; steel wires; polytetrafluoroethylene porous material; Celmet, a porous metal; cutting and plastic working tools; and alloy parts. The company was formerly known as Sumitomo Electric Wire & Cable Works and changed its name to Sumitomo Electric Industries, Ltd. in 1939. The company was founded in 1897 and is headquartered in Osaka, Japan.",1996-03-05,Auto Parts,https://www.sei.co.jp,286784,2.92E+12,NA,NA,81 6 6220 4141,NA,"5-33, Kitahama 4-chome","Osaka, , JP",541-0041,https://www.sei.co.jp,https://www.sei.co.jp,https://financialmodelingprep.com/image-stock/SMTOY.png,"#Sumitomo Electric Industries, Ltd., #Auto Parts, #Consumer Cyclical",10,1,TRUE,2022-05-23 17:49,2022-05-23 17:49
2724,"The 4Less Group, Inc.","The 4Less Group, Inc.","The 4Less Group, Inc. operates as an e-commerce retailer and distributor of auto and truck parts company in the United States. It offers exhaust systems, suspension systems, wheels, tires, stereo systems, truck bed covers, and shocks through its LiftKits4LESS.com, Bumpers4LESS.com, and TruckBedCovers4LESS.com Websites. The company is based in Las Vegas, Nevada.","The 4Less Group, Inc. operates as an e-commerce retailer and distributor of auto and truck parts company in the United States. It offers exhaust systems, suspension systems, wheels, tires, stereo systems, truck bed covers, and shocks through its LiftKits4LESS.com, Bumpers4LESS.com, and TruckBedCovers4LESS.com Websites. The company is based in Las Vegas, Nevada.",2019-07-03,Auto Parts,https://liftkits4less.com,7,11018751,Mr. Timothy G. Armes,NA,662 510 5866,NA,106 West Mayflower,"Las Vegas, NV, US",89030,https://liftkits4less.com,https://liftkits4less.com,https://financialmodelingprep.com/image-stock/FLES.png,"#The 4Less Group, Inc., #Auto Parts, #Consumer Cyclical",10,1,FALSE,2022-05-23 17:49,2022-05-23 17:49
2762,"Veoneer, Inc.","Veoneer, Inc.","Veoneer, Inc. engages in the design, development, manufacture, and sale of automotive safety electronics primarily in North America, Europe, and Asia. It offers mono-and stereo-vision cameras, night driving assist systems, advanced driver assist systems (ADAS), electronic control units, seat belt pre-tensioner electronic controllers, and ADAS software for highly automated driving (HAD) and autonomous driving (AD). The company also provides driver monitoring systems, LiDAR sensors, RoadScape positioning, and other technologies for ADAS, HAD, and AD solutions. Veoneer, Inc. was incorporated in 2017 and is headquartered in Stockholm, Sweden.","Veoneer, Inc. engages in the design, development, manufacture, and sale of automotive safety electronics primarily in North America, Europe, and Asia. It offers mono-and stereo-vision cameras, night driving assist systems, advanced driver assist systems (ADAS), electronic control units, seat belt pre-tensioner electronic controllers, and ADAS software for highly automated driving (HAD) and autonomous driving (AD). The company also provides driver monitoring systems, LiDAR sensors, RoadScape positioning, and other technologies for ADAS, HAD, and AD solutions. Veoneer, Inc. was incorporated in 2017 and is headquartered in Stockholm, Sweden.",2018-06-11,Auto Parts,https://www.veoneer.com,6033,1657000000,Mr. Jan Carlson,NA,46852776200,NA,Box 13089,"STOCKHOLM, STOCKHOLM, SE",103 02,https://www.veoneer.com,https://www.veoneer.com,https://financialmodelingprep.com/image-stock/VNE.png,"#Veoneer, Inc., #Auto Parts, #Consumer Cyclical",10,1,FALSE,2022-05-23 17:49,2022-05-23 17:49
2800,Omnitek Engineering Corp.,Omnitek Engineering Corp.,"Omnitek Engineering Corp. develops and sells technology to convert diesel engines to an alternative fuel, natural gas engines, and complementary products in the United States and internationally. The company offers conversion kits for converting diesel engines to run on an alternative fuel, including compressed, liquefied, and renewable natural gas, as well as liquid petroleum gas; natural gas engines and components; and high-pressure natural gas coalescing filters. Its products are used for stationary applications; and the transportation market, such as light commercial vehicles, minibuses, heavy-duty trucks, and municipal buses, as well as rail and marine applications. The company sells and delivers its products through its distributors, system integrators, fleet operators, and engine conversion companies, as well as directly to end-users. Omnitek Engineering Corp. was incorporated in 2001 and is headquartered in Vista, California.","Omnitek Engineering Corp. develops and sells technology to convert diesel engines to an alternative fuel, natural gas engines, and complementary products in the United States and internationally. The company offers conversion kits for converting diesel engines to run on an alternative fuel, including compressed, liquefied, and renewable natural gas, as well as liquid petroleum gas; natural gas engines and components; and high-pressure natural gas coalescing filters. Its products are used for stationary applications; and the transportation market, such as light commercial vehicles, minibuses, heavy-duty trucks, and municipal buses, as well as rail and marine applications. The company sells and delivers its products through its distributors, system integrators, fleet operators, and engine conversion companies, as well as directly to end-users. Omnitek Engineering Corp. was incorporated in 2001 and is headquartered in Vista, California.",2007-11-01,Auto Parts,https://www.omnitekcorp.com,6,1097467,Mr. Werner  Funk,NA,760 591 0089,NA,1333 Keystone Way,"Vista, CA, US",92081,https://www.omnitekcorp.com,https://www.omnitekcorp.com,https://financialmodelingprep.com/image-stock/OMTK.png,"#Omnitek Engineering Corp., #Auto Parts, #Consumer Cyclical",10,1,TRUE,2022-05-23 17:49,2022-05-23 17:49
2834,"Fuel Doctor Holdings, Inc.","Fuel Doctor Holdings, Inc.","Fuel Doctor Holdings, Inc. does not have significant operations. The company focuses on locating and negotiating with portfolio companies to acquire an interest in them. Previously, it was engaged in the design, marketing, and distribution of auto accessories. The company is based in Tel Aviv, Israel.","Fuel Doctor Holdings, Inc. does not have significant operations. The company focuses on locating and negotiating with portfolio companies to acquire an interest in them. Previously, it was engaged in the design, marketing, and distribution of auto accessories. The company is based in Tel Aviv, Israel.",2011-08-31,Auto Parts,,,0,NA,NA,707 373 3031,NA,410 Louisiana Street,"Vallejo, CA, US",94590,,,https://financialmodelingprep.com/image-stock/FDOC.png,"#Fuel Doctor Holdings, Inc., #Auto Parts, #Consumer Cyclical",10,1,TRUE,2022-05-23 17:49,2022-05-23 17:49
3170,Fox Factory Holding Corp.,Fox Factory Holding Corp.,"Fox Factory Holding Corp. designs, engineers, manufactures, and markets ride dynamics products worldwide. The company offers mid-end and high-end front fork and rear suspension products for mountain bikes, road bikes, and e-bikes; and powered vehicle products for side-by-side vehicles, on-road vehicles with and without off-road capabilities, off-road vehicles and trucks, all-terrain vehicles, snowmobiles, and specialty vehicles and applications, such as military, motorcycles, and commercial trucks. It also provides mountain and road bike wheels, and other performance cycling components, including cranks, chain rings, pedals, bars, stems, and seat posts, as well as sells aftermarket products to dealers and distributors. The company offers powered vehicles under the FOX, BDS Suspension, Zone Offroad, JKS Manufacturing, RT Pro UTV, 4x4 Posi-Lok, Ridetech, Tuscany, Outside Van, and SCA brands; and mountain bikes and road bikes under the FOX, Race Face, Easton Cycling, and Marzocchi brands. Fox Factory Holding Corp. was incorporated in 2007 and is headquartered in Duluth, Georgia.","Fox Factory Holding Corp. designs, engineers, manufactures, and markets ride dynamics products worldwide. The company offers mid-end and high-end front fork and rear suspension products for mountain bikes, road bikes, and e-bikes; and powered vehicle products for side-by-side vehicles, on-road vehicles with and without off-road capabilities, off-road vehicles and trucks, all-terrain vehicles, snowmobiles, and specialty vehicles and applications, such as military, motorcycles, and commercial trucks. It also provides mountain and road bike wheels, and other performance cycling components, including cranks, chain rings, pedals, bars, stems, and seat posts, as well as sells aftermarket products to dealers and distributors. The company offers powered vehicles under the FOX, BDS Suspension, Zone Offroad, JKS Manufacturing, RT Pro UTV, 4x4 Posi-Lok, Ridetech, Tuscany, Outside Van, and SCA brands; and mountain bikes and road bikes under the FOX, Race Face, Easton Cycling, and Marzocchi brands. Fox Factory Holding Corp. was incorporated in 2007 and is headquartered in Duluth, Georgia.",2013-08-08,Auto Parts,https://www.ridefox.com,4100,1299064000,Mr. Michael Dennison,NA,18312746500,NA,6634 Highway 53,"Braselton, GEORGIA, US",30097,https://www.ridefox.com,https://www.ridefox.com,https://financialmodelingprep.com/image-stock/FOXF.png,"#Fox Factory Holding Corp., #Auto Parts, #Consumer Cyclical",10,1,TRUE,2022-05-23 17:49,2022-05-23 17:49
3222,China Zenix Auto International Limited,China Zenix Auto International Limited,"China Zenix Auto International Limited designs, manufactures, and sells commercial vehicle wheels to aftermarket and original equipment manufacturers in the People's Republic of China. It offers tubed, tubeless, and off-road steel wheels; aluminum wheels; and wheel components, including wheel discs. The company sells its products directly and through a network of distributors under the Zhengxing, Zhengxing Prince, Haixia, Zhengchang, Lianxing, and CZX brands. It exports its products to approximately 27 countries worldwide. The company was formerly known as Richwheel Limited and changed its name to China Zenix Auto International Limited in November 2010. The company was founded in 2003 and is headquartered in Zhangzhou, the People's Republic of China. China Zenix Auto International Limited is a former subsidiary of Newrace Limited. As of January 27, 2022, China Zenix Auto International Limited was taken private.","China Zenix Auto International Limited designs, manufactures, and sells commercial vehicle wheels to aftermarket and original equipment manufacturers in the People's Republic of China. It offers tubed, tubeless, and off-road steel wheels; aluminum wheels; and wheel components, including wheel discs. The company sells its products directly and through a network of distributors under the Zhengxing, Zhengxing Prince, Haixia, Zhengchang, Lianxing, and CZX brands. It exports its products to approximately 27 countries worldwide. The company was formerly known as Richwheel Limited and changed its name to China Zenix Auto International Limited in November 2010. The company was founded in 2003 and is headquartered in Zhangzhou, the People's Republic of China. China Zenix Auto International Limited is a former subsidiary of Newrace Limited. As of January 27, 2022, China Zenix Auto International Limited was taken private.",2011-05-12,Auto Parts,https://www.zenixauto.com,3284,1769478000,Mr. Jianhui  Lai,NA,86 59 6260 0308,NA,No. 1608,"Zhangzhou, , CN",363000,https://www.zenixauto.com,https://www.zenixauto.com,https://financialmodelingprep.com/image-stock/ZXAIY.png,"#China Zenix Auto International Limited, #Auto Parts, #Consumer Cyclical",10,1,FALSE,2022-05-23 17:49,2022-05-23 17:49
3298,Hyliion Holdings Corp.,Hyliion Holdings Corp.,"Hyliion Holdings Corp. designs, develops, and sells electrified powertrain solutions for the commercial vehicle industry. It also provides battery management systems for hybrid and fully electric vehicle applications; and battery packs. The company was founded in 2015 and is headquartered in Cedar Park, Texas.","Hyliion Holdings Corp. designs, develops, and sells electrified powertrain solutions for the commercial vehicle industry. It also provides battery management systems for hybrid and fully electric vehicle applications; and battery packs. The company was founded in 2015 and is headquartered in Cedar Park, Texas.",2019-04-22,Auto Parts,https://www.hyliion.com,200,200000,Mr. Thomas J. Healy,NA,833 495 4466,NA,1202 BMC Drive,"Cedar Park, TX, US",78613,https://www.hyliion.com,https://www.hyliion.com,https://financialmodelingprep.com/image-stock/HYLN.png,"#Hyliion Holdings Corp., #Auto Parts, #Consumer Cyclical",10,1,TRUE,2022-05-23 17:49,2022-05-23 17:49
