,name,name_eng,description_short,description,founded_date,product,homepage,employee_cnt,revenue,ceo_name,email,tel,fax,address1,address2,post_code,facebook,youtube,logo,hash_tag,nation_id,industry_id,is_active,created_at,updated_at
7234,"Commercial Vehicle Group, Inc.","Commercial Vehicle Group, Inc.","Commercial Vehicle Group, Inc., together with its subsidiaries, designs, manufactures, produces, and sells components and assemblies in North America, Europe, and the Asia-Pacific regions. It operates in four segments: Vehicle Solutions, Warehouse Automation, Electrical Systems, and Aftermarket & Accessories. The company offers electrical wire harness assemblies that function as current carrying devices in providing electrical interconnections for gauges, lights, control functions, power circuits, powertrain and transmission sensors, emissions systems, and other electronic applications on commercial and other vehicles; and panel assemblies. It also offers electro-mechanical assemblies, such as box builds, complex automated and robotic assemblies, and large multi-cabinet control cabinets with power distribution and cabling; vinyl or cloth-covered appliqus, armrests, map pocket compartments, and sound-reducing insulations; instrument panels; and plastics decorating and finishing products. In addition, it provides cab structures; design products, including armrests, grab handles, storage systems, floor coverings, floor mats, sleeper bunks, headliners, wall panels, and privacy curtains; and mirrors, wipers, and controls used in commercial, military and specialty recreational vehicles. Further, it offers seats and seating systems, such as mechanical and air suspension, static and military seats, and bus, as well as seats for medium-and heavy-duty trucks (MD/HD trucks); office seating products; and seats, parts, and components for the aftermarket. The company supplies its products and systems for the commercial vehicle market comprising the MD/HD truck market; and MD/HD truck, bus, construction, mining, agricultural, military, industrial, municipal, off-road recreational, and specialty vehicle markets. Commercial Vehicle Group, Inc. was incorporated in 2000 and is headquartered in New Albany, Ohio.","Commercial Vehicle Group, Inc., together with its subsidiaries, designs, manufactures, produces, and sells components and assemblies in North America, Europe, and the Asia-Pacific regions. It operates in four segments: Vehicle Solutions, Warehouse Automation, Electrical Systems, and Aftermarket & Accessories. The company offers electrical wire harness assemblies that function as current carrying devices in providing electrical interconnections for gauges, lights, control functions, power circuits, powertrain and transmission sensors, emissions systems, and other electronic applications on commercial and other vehicles; and panel assemblies. It also offers electro-mechanical assemblies, such as box builds, complex automated and robotic assemblies, and large multi-cabinet control cabinets with power distribution and cabling; vinyl or cloth-covered appliqus, armrests, map pocket compartments, and sound-reducing insulations; instrument panels; and plastics decorating and finishing products. In addition, it provides cab structures; design products, including armrests, grab handles, storage systems, floor coverings, floor mats, sleeper bunks, headliners, wall panels, and privacy curtains; and mirrors, wipers, and controls used in commercial, military and specialty recreational vehicles. Further, it offers seats and seating systems, such as mechanical and air suspension, static and military seats, and bus, as well as seats for medium-and heavy-duty trucks (MD/HD trucks); office seating products; and seats, parts, and components for the aftermarket. The company supplies its products and systems for the commercial vehicle market comprising the MD/HD truck market; and MD/HD truck, bus, construction, mining, agricultural, military, industrial, municipal, off-road recreational, and specialty vehicle markets. Commercial Vehicle Group, Inc. was incorporated in 2000 and is headquartered in New Albany, Ohio.",2004-08-05,Auto Parts,https://cvgrp.com,7300,971578000,Mr. Harold Bevis,NA,16142895360,NA,7800 Walton Pkwy,"New Albany, OHIO, US",43054,https://cvgrp.com,https://cvgrp.com,https://financialmodelingprep.com/image-stock/CVGI.jpg,"#Commercial Vehicle Group, Inc., #Auto Parts, #Consumer Cyclical",10,1,TRUE,2022-05-23 17:49,2022-05-23 17:49
7636,Sterling Consolidated Corp.,Sterling Consolidated Corp.,"Sterling Consolidated Corp., through its subsidiaries, distributes and sells O-rings and other rubber products worldwide. It provides rubber seals, oil seals, custom molded rubber parts, custom Teflon parts, Teflon rods, O-ring cords, bonded seals, O-ring kits, and stuffing box sealant products for automotive, pump, transmission, oil and energy, machinery, and packaging industrial applications. The company also offers freight forwarding and related services; and rents commercial space to third parties. It serves smaller distributors and original equipment manufacturers. The company was formerly known as Oceanview Acquisition Corp. and changed its name to Sterling Consolidated Corp. in May 2012. Sterling Consolidated Corp. was founded in 1970 and is headquartered in Neptune, New Jersey.","Sterling Consolidated Corp., through its subsidiaries, distributes and sells O-rings and other rubber products worldwide. It provides rubber seals, oil seals, custom molded rubber parts, custom Teflon parts, Teflon rods, O-ring cords, bonded seals, O-ring kits, and stuffing box sealant products for automotive, pump, transmission, oil and energy, machinery, and packaging industrial applications. The company also offers freight forwarding and related services; and rents commercial space to third parties. It serves smaller distributors and original equipment manufacturers. The company was formerly known as Oceanview Acquisition Corp. and changed its name to Sterling Consolidated Corp. in May 2012. Sterling Consolidated Corp. was founded in 1970 and is headquartered in Neptune, New Jersey.",2013-04-30,Auto Parts,https://www.sterlingconsolidated.com,,8814102,Mr. Darren  DeRosa,NA,732 918 8114,NA,1105 Green Grove Road,"Neptune, NJ, US",7753,https://www.sterlingconsolidated.com,https://www.sterlingconsolidated.com,https://financialmodelingprep.com/image-stock/STCC.png,"#Sterling Consolidated Corp., #Auto Parts, #Consumer Cyclical",10,1,TRUE,2022-05-23 17:49,2022-05-23 17:49
7962,Gentherm Incorporated,Gentherm Incorporated,"Gentherm Incorporated designs, develops, manufactures, and markets thermal management technologies. The company operates in two segments, Automotive and Medical. The Automotive segment offers climate comfort systems, which include seat heaters, blowers, and thermoelectric devices for variable temperature climate control seats and steering wheel heaters that are designed to provide thermal comfort to automobile passengers; integrated electronic components, such as electronic control units that utilize proprietary electronics technology and software; and other climate comfort systems, including neck conditioners and climate control system products for door panels, armrests, cupholders, and storage bins. It also provides battery performance solutions comprising cell connecting devices and battery cable technologies used for various types of automotive batteries, as well as thermal management products for heating and cooling 12 volts, 48 volts, and high voltage batteries and battery modules; and automotive electronic and software systems, including electronic control units for climate comfort systems, as well as for memory seat modules and other devices. This segment serves light vehicle original equipment manufacturers and first tier suppliers, such as automotive seat manufacturers, as well as aftermarket seat distributors and installers. The Medical segment offers patient temperature management systems. The company provides its products and services in the United States, Germany, Canada, China, Hungary, Japan, South Korea, Romania, Macedonia, Malta, Mexico, the United Kingdom, Ukraine, and Vietnam. The company was formerly known as Amerigon Incorporated and changed its name to Gentherm Incorporated in September 2012. Gentherm Incorporated was incorporated in 1991 and is headquartered in Northville, Michigan.","Gentherm Incorporated designs, develops, manufactures, and markets thermal management technologies. The company operates in two segments, Automotive and Medical. The Automotive segment offers climate comfort systems, which include seat heaters, blowers, and thermoelectric devices for variable temperature climate control seats and steering wheel heaters that are designed to provide thermal comfort to automobile passengers; integrated electronic components, such as electronic control units that utilize proprietary electronics technology and software; and other climate comfort systems, including neck conditioners and climate control system products for door panels, armrests, cupholders, and storage bins. It also provides battery performance solutions comprising cell connecting devices and battery cable technologies used for various types of automotive batteries, as well as thermal management products for heating and cooling 12 volts, 48 volts, and high voltage batteries and battery modules; and automotive electronic and software systems, including electronic control units for climate comfort systems, as well as for memory seat modules and other devices. This segment serves light vehicle original equipment manufacturers and first tier suppliers, such as automotive seat manufacturers, as well as aftermarket seat distributors and installers. The Medical segment offers patient temperature management systems. The company provides its products and services in the United States, Germany, Canada, China, Hungary, Japan, South Korea, Romania, Macedonia, Malta, Mexico, the United Kingdom, Ukraine, and Vietnam. The company was formerly known as Amerigon Incorporated and changed its name to Gentherm Incorporated in September 2012. Gentherm Incorporated was incorporated in 1991 and is headquartered in Northville, Michigan.",1993-06-11,Auto Parts,https://gentherm.com,10474,1046150000,Mr. Phillip Eyler,NA,12485040500,NA,21680 Haggerty Rd,"Northville, MICHIGAN, US",48167,https://gentherm.com,https://gentherm.com,https://financialmodelingprep.com/image-stock/THRM.png,"#Gentherm Incorporated, #Auto Parts, #Consumer Cyclical",10,1,TRUE,2022-05-23 17:49,2022-05-23 17:49
8359,"The Yokohama Rubber Co., Ltd.","The Yokohama Rubber Co., Ltd.","The Yokohama Rubber Co., Ltd. manufactures and sells tires in Japan, the United States, India, China, the Philippines, and internationally. It operates through Tires, Multiple Business (MB), and Alliance Tire Group (ATG) segments. The Tires segment offers tires for passenger cars and light trucks, trucks and buses, construction and mining equipment, and motorsports, as well as tire tubes, aluminum alloy wheels, and other peripheral products under the ADVAN, BluEarth, iceGUARD, GEOLANDAR, YOKOHAMA, ALLIANCE, GALAXY, PRIMEX, and AICHI brand names. The MB segment provides conveyor belts, rubber plates, various hoses, marine fenders, oil spill containment booms, marine hoses, rubber molded products, air springs, highway joints, rubber support, anti-seismic laminated rubber sheets for buildings, sound- and vibration-proof materials, and aerospace products comprise aircraft fixtures and components. It also offers adhesives and sealants under the Hamatite brand. The ATG segment provides tires for agricultural, industrial, construction, and forestry machinery. It also markets golf equipment and services under the PRGR brand. The Yokohama Rubber Co., Ltd. was incorporated in 1917 and is headquartered in Tokyo, Japan.","The Yokohama Rubber Co., Ltd. manufactures and sells tires in Japan, the United States, India, China, the Philippines, and internationally. It operates through Tires, Multiple Business (MB), and Alliance Tire Group (ATG) segments. The Tires segment offers tires for passenger cars and light trucks, trucks and buses, construction and mining equipment, and motorsports, as well as tire tubes, aluminum alloy wheels, and other peripheral products under the ADVAN, BluEarth, iceGUARD, GEOLANDAR, YOKOHAMA, ALLIANCE, GALAXY, PRIMEX, and AICHI brand names. The MB segment provides conveyor belts, rubber plates, various hoses, marine fenders, oil spill containment booms, marine hoses, rubber molded products, air springs, highway joints, rubber support, anti-seismic laminated rubber sheets for buildings, sound- and vibration-proof materials, and aerospace products comprise aircraft fixtures and components. It also offers adhesives and sealants under the Hamatite brand. The ATG segment provides tires for agricultural, industrial, construction, and forestry machinery. It also markets golf equipment and services under the PRGR brand. The Yokohama Rubber Co., Ltd. was incorporated in 1917 and is headquartered in Tokyo, Japan.",2016-03-28,Auto Parts,https://www.y-yokohama.com,27222,6.71E+11,NA,NA,81 3 5400 4531,NA,"36-11, Shimbashi 5-chome","Tokyo, , JP",105-8685,https://www.y-yokohama.com,https://www.y-yokohama.com,https://financialmodelingprep.com/image-stock/YORUY.png,"#The Yokohama Rubber Co., Ltd., #Auto Parts, #Consumer Cyclical",10,1,TRUE,2022-05-23 17:49,2022-05-23 17:49
8424,Amerityre Corporation,Amerityre Corporation,"Amerityre Corporation engages in the research and development, manufacture, and sale of polyurethane tires in the United States. The company provides closed-cell polyurethane foam tires for bicycles, golf and baggage carts, hand trucks, lawn and garden equipment, wheelbarrows, personnel carriers, and medical mobility products, as well as custom designed applications; polyurethane elastomer industrial tires for forklifts and scissor lifts; agricultural tires, including seeder tires and hay baler tires, as well as flat-free pivot tires that are used in irrigation systems; and specialty tires and tire-wheel assemblies. It serves original equipment manufacturers of lawn and garden products, and outdoor power equipment; regional tire distributors; retail cooperatives; agricultural tire distributors; and retailers of lawn and garden products, bicycle tires, and hand truck tires. The company was formerly known as American Tire Corporation and changed its name to Amerityre Corporation in December 1999. Amerityre Corporation was founded in 1995 and is headquartered in Boulder City, Nevada.","Amerityre Corporation engages in the research and development, manufacture, and sale of polyurethane tires in the United States. The company provides closed-cell polyurethane foam tires for bicycles, golf and baggage carts, hand trucks, lawn and garden equipment, wheelbarrows, personnel carriers, and medical mobility products, as well as custom designed applications; polyurethane elastomer industrial tires for forklifts and scissor lifts; agricultural tires, including seeder tires and hay baler tires, as well as flat-free pivot tires that are used in irrigation systems; and specialty tires and tire-wheel assemblies. It serves original equipment manufacturers of lawn and garden products, and outdoor power equipment; regional tire distributors; retail cooperatives; agricultural tire distributors; and retailers of lawn and garden products, bicycle tires, and hand truck tires. The company was formerly known as American Tire Corporation and changed its name to Amerityre Corporation in December 1999. Amerityre Corporation was founded in 1995 and is headquartered in Boulder City, Nevada.",1996-10-17,Auto Parts,https://www.amerityre.com,17,4863412,Mr. Michael Francis Sullivan,NA,702 293 1930,NA,1501 Industrial Road,"Boulder City, NV, US",89005,https://www.amerityre.com,https://www.amerityre.com,https://financialmodelingprep.com/image-stock/AMTY.png,"#Amerityre Corporation, #Auto Parts, #Consumer Cyclical",10,1,TRUE,2022-05-23 17:49,2022-05-23 17:49
8611,Tenneco Inc.,Tenneco Inc.,"Tenneco Inc. designs, manufactures, and sells clean air, and powertrain products and systems for light vehicle, commercial truck, off-highway, industrial, motorsport, and aftermarket customers worldwide. It operates through four segments: Motorparts, Performance Solutions, Clean Air, and Powertrain. The Motorparts segment offers shock and strut, steering and suspension, braking, sealing, emissions control, engine, and maintenance products under the Monroe, Champion, hlins, MOOG, Walker, Fel-Pro, Wagner, Ferodo, Rancho, Thrush, National, Sealed Power, and other brands. The Performance Solutions segment designs, manufactures, markets, and distributes noise, vibration, and harshness performance materials; advanced suspension technologies; and ride control, braking, and systems protection products. The Clean Air segment offers catalytic converters and diesel oxidation catalysts; diesel particulate filters; burner systems; lean nitrogen oxide (NOx) traps; selective catalytic reduction (SCR) systems; hydrocarbon vaporizers and injectors; SCR-coated diesel particulate filters systems; urea dosing systems; four-way catalysts; alternative NOx reduction technologies; mufflers and resonators; fabricated exhaust manifolds; pipes; hydroformed assemblies; elastomeric hangers and isolators; and aftertreatment control units. The Powertrain segment provides pistons, piston rings, piston pins, cylinder liners, valvetrain products, valve seats and guides, ignition products, dynamic seals, bonded piston seals, combustion and exhaust gaskets, static gaskets and seals, engine bearings, industrial bearings, and bushings and washers. The company was formerly known as Tenneco Automotive Inc. and changed its name to Tenneco Inc. in 2005. Tenneco Inc. was incorporated in 1996 and is based in Southfield, Michigan.","Tenneco Inc. designs, manufactures, and sells clean air, and powertrain products and systems for light vehicle, commercial truck, off-highway, industrial, motorsport, and aftermarket customers worldwide. It operates through four segments: Motorparts, Performance Solutions, Clean Air, and Powertrain. The Motorparts segment offers shock and strut, steering and suspension, braking, sealing, emissions control, engine, and maintenance products under the Monroe, Champion, hlins, MOOG, Walker, Fel-Pro, Wagner, Ferodo, Rancho, Thrush, National, Sealed Power, and other brands. The Performance Solutions segment designs, manufactures, markets, and distributes noise, vibration, and harshness performance materials; advanced suspension technologies; and ride control, braking, and systems protection products. The Clean Air segment offers catalytic converters and diesel oxidation catalysts; diesel particulate filters; burner systems; lean nitrogen oxide (NOx) traps; selective catalytic reduction (SCR) systems; hydrocarbon vaporizers and injectors; SCR-coated diesel particulate filters systems; urea dosing systems; four-way catalysts; alternative NOx reduction technologies; mufflers and resonators; fabricated exhaust manifolds; pipes; hydroformed assemblies; elastomeric hangers and isolators; and aftertreatment control units. The Powertrain segment provides pistons, piston rings, piston pins, cylinder liners, valvetrain products, valve seats and guides, ignition products, dynamic seals, bonded piston seals, combustion and exhaust gaskets, static gaskets and seals, engine bearings, industrial bearings, and bushings and washers. The company was formerly known as Tenneco Automotive Inc. and changed its name to Tenneco Inc. in 2005. Tenneco Inc. was incorporated in 1996 and is based in Southfield, Michigan.",1996-12-12,Auto Parts,https://www.tenneco.com,71000,18035000000,Mr. Brian Kesseler,NA,18474825000,NA,500 N Field Dr,"Lake Forest, ILLINOIS, US",60045,https://www.tenneco.com,https://www.tenneco.com,https://financialmodelingprep.com/image-stock/TEN.png,"#Tenneco Inc., #Auto Parts, #Consumer Cyclical",10,1,TRUE,2022-05-23 17:49,2022-05-23 17:49
8880,XL Fleet Corp.,XL Fleet Corp.,"XL Fleet Corp. provides fleet electrification solutions for commercial vehicles in North America. Its products include hybrid electric drive systems are comprised of an electric motor that is mounted onto the vehicle's drive shaft, an inverter motor controller, and a lithium-ion battery pack to store energy to be used for propulsion; plug-in hybrid electric drive system, which are fitted to vehicles. In addition, the company offers vehicle electrification and infrastructure solutions, and charging stations. It serves end-use customer base comprising Fortune 500 corporate enterprises, public utilities, and various municipalities. The company was incorporated in 2009 and is headquartered in Boston, Massachusetts.","XL Fleet Corp. provides fleet electrification solutions for commercial vehicles in North America. Its products include hybrid electric drive systems are comprised of an electric motor that is mounted onto the vehicle's drive shaft, an inverter motor controller, and a lithium-ion battery pack to store energy to be used for propulsion; plug-in hybrid electric drive system, which are fitted to vehicles. In addition, the company offers vehicle electrification and infrastructure solutions, and charging stations. It serves end-use customer base comprising Fortune 500 corporate enterprises, public utilities, and various municipalities. The company was incorporated in 2009 and is headquartered in Boston, Massachusetts.",2019-09-03,Auto Parts,https://www.xlfleet.com,177,15600000,None,NA,617 718 0329,NA,145 Newton Street,"Boston, MA, US",2135,https://www.xlfleet.com,https://www.xlfleet.com,https://financialmodelingprep.com/image-stock/XL.jpg,"#XL Fleet Corp., #Auto Parts, #Consumer Cyclical",10,1,TRUE,2022-05-23 17:49,2022-05-23 17:49
8898,Magna International Inc.,Magna International Inc.,"Magna International Inc. designs, engineers, and manufactures components, assemblies, systems, subsystems, and modules for original equipment manufacturers of vehicles and light trucks worldwide. It operates through four segments: Body Exteriors & Structures, Power & Vision, Seating Systems, and Complete Vehicles. The Body Exteriors & Structures segment provides body and chassis, exterior, and roof systems, as well as battery enclosures and engineering and testing services, including fascia and trims, front end modules, front integration panels, liftgate modules, active aerodynamics, engineered glass, running boards, truck bed access products, and side doors. The Power & Vision segment offers hybrid and electric drive systems, motors, inverters, onboard chargers, and e-clutch; dedicated hybrid, dual and hybrid dual, and manual transmissions; AWD/4WD products and rear drive modules; transmission, engine, driveline components, engine drive plates, and accessories; engineering services; advanced driver assistance systems and sensors, and electronic control units; interior and exterior mirrors, camera and driver monitoring systems and electronics, actuators, door handles, and overhead consoles; forward, rear, and auxiliary lighting products; latching, door modules, window, power closure, and hinges and wire forming systems; and modular and textile folding roofs, and hard and soft tops. The Seating Systems segment provides seat structures, mechanism and hardware solutions, and foam and trim products. The Complete Vehicles segment offers vehicle engineering and manufacturing services. The company also designs, engineers, and manufactures tooling products. Magna International Inc. was founded in 1957 and is headquartered in Aurora, Canada.","Magna International Inc. designs, engineers, and manufactures components, assemblies, systems, subsystems, and modules for original equipment manufacturers of vehicles and light trucks worldwide. It operates through four segments: Body Exteriors & Structures, Power & Vision, Seating Systems, and Complete Vehicles. The Body Exteriors & Structures segment provides body and chassis, exterior, and roof systems, as well as battery enclosures and engineering and testing services, including fascia and trims, front end modules, front integration panels, liftgate modules, active aerodynamics, engineered glass, running boards, truck bed access products, and side doors. The Power & Vision segment offers hybrid and electric drive systems, motors, inverters, onboard chargers, and e-clutch; dedicated hybrid, dual and hybrid dual, and manual transmissions; AWD/4WD products and rear drive modules; transmission, engine, driveline components, engine drive plates, and accessories; engineering services; advanced driver assistance systems and sensors, and electronic control units; interior and exterior mirrors, camera and driver monitoring systems and electronics, actuators, door handles, and overhead consoles; forward, rear, and auxiliary lighting products; latching, door modules, window, power closure, and hinges and wire forming systems; and modular and textile folding roofs, and hard and soft tops. The Seating Systems segment provides seat structures, mechanism and hardware solutions, and foam and trim products. The Complete Vehicles segment offers vehicle engineering and manufacturing services. The company also designs, engineers, and manufactures tooling products. Magna International Inc. was founded in 1957 and is headquartered in Aurora, Canada.",1984-08-24,Auto Parts,https://www.magna.com,161000,36242000000,Mr. Donald Walker,NA,19057262462,NA,"337 Magna Drive, N/A","Aurora, ONTARIO, CA",L4G 7K1,https://www.magna.com,https://www.magna.com,https://financialmodelingprep.com/image-stock/MGA.png,"#Magna International Inc., #Auto Parts, #Consumer Cyclical",10,1,TRUE,2022-05-23 17:49,2022-05-23 17:49
